[
  {
    "id": "job_junior_dev",
    "title": "Junior Front-End Dev",
    "company": "Startup Local",
    "salary": 9000,
    "cost": {
      "energy": -60
    },
    "imageUrl": "/images/jobs/junior_frontend.png",
    "requirements": {
      "skills": [
        {
          "name": "Frontend",
          "level": 1
        }
      ]
    }
  },
  {
    "id": "job_python_dev",
    "title": "Python Dev",
    "company": "FinTech",
    "salary": 15000,
    "cost": {
      "energy": -60
    },
    "imageUrl": "/images/jobs/python_dev.png",
    "requirements": {
      "skills": [
        {
          "name": "Python",
          "level": 2
        }
      ]
    }
  },
  {
    "id": "job_data_analyst",
    "title": "Data Analyst",
    "company": "Rede Varejo",
    "salary": 18000,
    "cost": {
      "energy": -75
    },
    "imageUrl": "/images/jobs/data_analyst.png",
    "requirements": {
      "skills": [
        {
          "name": "Análise de Dados",
          "level": 2
        }
      ]
    }
  },
  {
    "id": "job_marketing",
    "title": "Especialista em Marketing Digital",
    "company": "Agência Local",
    "salary": 12000,
    "cost": {
      "energy": -45
    },
    "imageUrl": "/images/jobs/marketing.png",
    "requirements": {
      "skills": [
        {
          "name": "Marketing",
          "level": 2
        }
      ]
    }
  },
  {
    "id": "job_senior_dev",
    "title": "Senior Full-Stack Eng",
    "company": "Grande Empresa",
    "salary": 30000,
    "cost": {
      "energy": -90
    },
    "imageUrl": "/images/jobs/senior_fullstack.png",
    "requirements": {
      "skills": [
        {
          "name": "Full-Stack",
          "level": 3
        }
      ]
    }
  }
]
